{
  "$schema": "./schema/components.schema.json",
  "generatedFrom": [
    "label-spec.json",
    "layout.json"
  ],
  "templateVersion": "2.2.0",
  "note": "Derived file — regenerate with `npm run build:components`. Do not hand-edit; edit label-spec.json / layout.json instead. Every visible object in master-label.svg is listed here as one addressable component with its full editable property set: geometry, lock state, default placeholder, alignment, auto-fit bounds, field-map key (if content-editable), and every theme token that restyles it.",
  "components": [
    {
      "id": "background",
      "type": "shape",
      "layer": "background_layer",
      "role": "background color",
      "position": {
        "xPct": 0,
        "yPct": 0,
        "widthPct": 100,
        "heightPct": 100
      },
      "textAnchor": null,
      "alignment": null,
      "baselineYPct": null,
      "locked": true,
      "defaultPlaceholder": null,
      "autoFit": {
        "enabled": false
      },
      "field": null,
      "themeTokens": [
        {
          "token": "colors.background",
          "attr": "fill"
        }
      ],
      "fontRole": null
    },
    {
      "id": "border",
      "type": "shape",
      "layer": "background_layer",
      "role": "border color, thickness, radius",
      "position": {
        "xPct": 1.177,
        "yPct": 2.706,
        "widthPct": 97.646,
        "heightPct": 94.589
      },
      "textAnchor": null,
      "alignment": null,
      "baselineYPct": null,
      "locked": true,
      "defaultPlaceholder": null,
      "autoFit": {
        "enabled": false
      },
      "field": null,
      "themeTokens": [
        {
          "token": "colors.border",
          "attr": "stroke"
        },
        {
          "token": "border.thickness",
          "attr": "stroke-width"
        },
        {
          "token": "border.radius",
          "attr": "rx"
        },
        {
          "token": "border.radius",
          "attr": "ry"
        }
      ],
      "fontRole": null
    },
    {
      "id": "divider_left",
      "type": "shape",
      "layer": "divider_layer",
      "role": "brand/product vertical divider",
      "position": {
        "xPct": 32.957,
        "yPct": 10.823,
        "widthPct": 0.471,
        "heightPct": 78.463
      },
      "textAnchor": null,
      "alignment": null,
      "baselineYPct": null,
      "locked": true,
      "defaultPlaceholder": null,
      "autoFit": {
        "enabled": false
      },
      "field": null,
      "themeTokens": [
        {
          "token": "colors.accent",
          "attr": "stroke"
        }
      ],
      "fontRole": null
    },
    {
      "id": "divider_right",
      "type": "shape",
      "layer": "divider_layer",
      "role": "product/verification vertical divider",
      "position": {
        "xPct": 69.052,
        "yPct": 10.823,
        "widthPct": 0.471,
        "heightPct": 78.463
      },
      "textAnchor": null,
      "alignment": null,
      "baselineYPct": null,
      "locked": true,
      "defaultPlaceholder": null,
      "autoFit": {
        "enabled": false
      },
      "field": null,
      "themeTokens": [
        {
          "token": "colors.accent",
          "attr": "stroke"
        }
      ],
      "fontRole": null
    },
    {
      "id": "brand_logo",
      "type": "image",
      "layer": "brand_layer",
      "role": "primary brand logo placeholder",
      "position": {
        "xPct": 4.708,
        "yPct": 10.823,
        "widthPct": 10.201,
        "heightPct": 23.449
      },
      "textAnchor": null,
      "alignment": null,
      "baselineYPct": null,
      "locked": false,
      "defaultPlaceholder": "placeholder-logo.svg",
      "autoFit": {
        "enabled": false
      },
      "field": {
        "fieldKey": "brand_logo",
        "required": true,
        "maxLength": null,
        "applyAs": "attr:href",
        "description": "Relative path to the primary brand logo asset (svg/png)."
      },
      "themeTokens": [],
      "fontRole": null
    },
    {
      "id": "brand_logo_secondary",
      "type": "use",
      "layer": "brand_layer",
      "role": "optional secondary logo/certification badge",
      "position": {
        "xPct": 16.871,
        "yPct": 13.528,
        "widthPct": 6.277,
        "heightPct": 14.43
      },
      "textAnchor": null,
      "alignment": null,
      "baselineYPct": null,
      "locked": false,
      "defaultPlaceholder": "#icon-logo-secondary",
      "autoFit": {
        "enabled": false
      },
      "field": {
        "fieldKey": "brand_logo_secondary",
        "required": false,
        "maxLength": null,
        "applyAs": "attr:href",
        "description": "Optional secondary logo/certification badge — points at a symbol id (e.g. \"#icon-logo-secondary\") or a swapped-in asset."
      },
      "themeTokens": [
        {
          "token": "colors.darkAccent",
          "attr": "fill"
        },
        {
          "token": "colors.darkAccent",
          "attr": "stroke"
        }
      ],
      "fontRole": null
    },
    {
      "id": "brand_name",
      "type": "text",
      "layer": "brand_layer",
      "role": "brand name",
      "position": {
        "xPct": 4.708,
        "yPct": 39.394,
        "widthPct": 26.679,
        "heightPct": 10.786
      },
      "textAnchor": "start",
      "alignment": "left",
      "baselineYPct": 46.898,
      "locked": false,
      "defaultPlaceholder": "BRAND NAME",
      "autoFit": {
        "enabled": true,
        "baseFontSizePt": 5.2,
        "minFontSizePt": 3.2
      },
      "field": {
        "fieldKey": "brand_name",
        "required": true,
        "maxLength": 22,
        "applyAs": "text",
        "description": "Brand name."
      },
      "themeTokens": [
        {
          "token": "colors.primary",
          "attr": "fill"
        }
      ],
      "fontRole": "heading"
    },
    {
      "id": "brand_subtitle",
      "type": "text",
      "layer": "brand_layer",
      "role": "brand subtitle",
      "position": {
        "xPct": 4.708,
        "yPct": 51.154,
        "widthPct": 26.679,
        "heightPct": 6.854
      },
      "textAnchor": "start",
      "alignment": "left",
      "baselineYPct": 55.916,
      "locked": false,
      "defaultPlaceholder": "BRAND SUBTITLE",
      "autoFit": {
        "enabled": false
      },
      "field": {
        "fieldKey": "brand_subtitle",
        "required": false,
        "maxLength": 18,
        "applyAs": "text",
        "description": "Brand subtitle, shown under the brand name. Fixed-width column, does not auto-shrink."
      },
      "themeTokens": [
        {
          "token": "colors.secondary",
          "attr": "fill"
        }
      ],
      "fontRole": "subheading"
    },
    {
      "id": "brand_decorative_graphic",
      "type": "use",
      "layer": "brand_layer",
      "role": "optional decorative brand accent graphic",
      "position": {
        "xPct": 4.708,
        "yPct": 60.606,
        "widthPct": 2.511,
        "heightPct": 5.772
      },
      "textAnchor": null,
      "alignment": null,
      "baselineYPct": null,
      "locked": false,
      "defaultPlaceholder": "#icon-decorative",
      "autoFit": {
        "enabled": false
      },
      "field": {
        "fieldKey": "brand_decorative_graphic",
        "required": false,
        "maxLength": null,
        "applyAs": "attr:href",
        "description": "Optional decorative accent graphic — points at a symbol id or a swapped-in asset."
      },
      "themeTokens": [
        {
          "token": "colors.accent",
          "attr": "fill"
        },
        {
          "token": "colors.accent",
          "attr": "stroke"
        }
      ],
      "fontRole": null
    },
    {
      "id": "brand_tagline",
      "type": "text",
      "layer": "brand_layer",
      "role": "brand tagline",
      "position": {
        "xPct": 8.318,
        "yPct": 61.688,
        "widthPct": 23.07,
        "heightPct": 6.223
      },
      "textAnchor": "start",
      "alignment": "left",
      "baselineYPct": 66.017,
      "locked": false,
      "defaultPlaceholder": "BRAND TAGLINE",
      "autoFit": {
        "enabled": true,
        "baseFontSizePt": 3,
        "minFontSizePt": 2.2
      },
      "field": {
        "fieldKey": "brand_tagline",
        "required": false,
        "maxLength": 24,
        "applyAs": "text",
        "description": "Short brand tagline next to the decorative accent graphic. Auto-fit: shrinks font-size if needed (see scripts/lib/autoFit.js) — this maxLength is a soft guideline, not a hard cutoff."
      },
      "themeTokens": [
        {
          "token": "colors.accent",
          "attr": "fill"
        }
      ],
      "fontRole": null
    },
    {
      "id": "product_name",
      "type": "text",
      "layer": "product_layer",
      "role": "peptide/product name",
      "position": {
        "xPct": 36.095,
        "yPct": 22.547,
        "widthPct": 31.387,
        "heightPct": 10.372
      },
      "textAnchor": "start",
      "alignment": "left",
      "baselineYPct": 29.762,
      "locked": false,
      "defaultPlaceholder": "PEPTIDE NAME",
      "autoFit": {
        "enabled": true,
        "baseFontSizePt": 5,
        "minFontSizePt": 3
      },
      "field": {
        "fieldKey": "product_name",
        "required": true,
        "maxLength": 20,
        "applyAs": "text",
        "description": "Peptide/product name."
      },
      "themeTokens": [
        {
          "token": "colors.primary",
          "attr": "fill"
        }
      ],
      "fontRole": "heading"
    },
    {
      "id": "product_descriptor",
      "type": "text",
      "layer": "product_layer",
      "role": "product descriptor",
      "position": {
        "xPct": 36.095,
        "yPct": 34.127,
        "widthPct": 31.387,
        "heightPct": 5.393
      },
      "textAnchor": "start",
      "alignment": "left",
      "baselineYPct": 37.879,
      "locked": false,